### ISSUE TITLE
dnsq never resolves an address

### ISSUE THREAD

**Issue by deployable** [pjps/ndjbdns#19]
The `dnsq` utility never receives a response to it's queries from the `dnccache` process, or any dns server for that matter. 

The requests make it into the server, but no response (or errors or debug) are generated. 

Running with `dnscache` in the background with a `tcpdump` watching the traffic.

sudo dnscache -c dnscache.conf  &
sudo tcpdump -nn -pi lo port 53 &

```
[vagrant@localhost ndjbdns]$  ../../bin/dnsq a google.com 127.0.0.1
02:15:06.786874 IP 127.0.0.1.53959 > 127.0.0.1.53: 59192 A? google.com. (28)
02:15:07.814536 IP 127.0.0.1.51585 > 127.0.0.1.53: 20475 A? google.com. (28)
02:15:10.836891 IP 127.0.0.1.46061 > 127.0.0.1.53: 17593 A? google.com. (28)
```

```
[vagrant@localhost ndjbdns]$ dig @127.0.0.1 google.com
02:16:51.448684 IP 127.0.0.1.37417 > 127.0.0.1.53: 28292+ [1au] A? google.com. (39)
Sep 16 2015 02:16:51 Q3 127.0.0.1:37417 28292 A? google.com.
Sep 16 2015 02:16:51 R3 0:success 1 44
02:16:51.448888 IP 127.0.0.1.53 > 127.0.0.1.37417: 28292 1/0/0 A 216.58.220.142 (44)

; <<>> DiG 9.9.4-RedHat-9.9.4-18.el7_1.5 <<>> @127.0.0.1 google.com
; (1 server found)
;; global options: +cmd
;; Got answer:
;; ->>HEADER<<- opcode: QUERY, status: NOERROR, id: 28292
;; flags: qr rd ra; QUERY: 1, ANSWER: 1, AUTHORITY: 0, ADDITIONAL: 0

;; QUESTION SECTION:
;google.com.			IN	A

;; ANSWER SECTION:
google.com.		156	IN	A	216.58.220.142

;; Query time: 0 msec
;; SERVER: 127.0.0.1#53(127.0.0.1)
;; WHEN: Wed Sep 16 02:16:51 UTC 2015
;; MSG SIZE  rcvd: 44
```

```
[vagrant@localhost ndjbdns]$ nslookup google.com 127.0.0.1
02:17:05.638672 IP 127.0.0.1.40854 > 127.0.0.1.53: 14134+ A? google.com. (28)
Sep 16 2015 02:17:05 Q4 127.0.0.1:40854 14134 A? google.com.
Sep 16 2015 02:17:05 R4 0:success 1 44
02:17:05.638875 IP 127.0.0.1.53 > 127.0.0.1.40854: 14134 1/0/0 A 216.58.220.142 (44)
Server:		127.0.0.1
Address:	127.0.0.1#53

Non-authoritative answer:
Name:	google.com
Address: 216.58.220.142
```

This is on both a linux and mac build

**Comment by deployable** [comment]
I see `dnsq` sets the non recursive flag in the queries it sends. So it will only work when sending requests to a name server with the domain locally configured. Could that become a command line option?
